English, Bahnar
"therefore thus says the Lord GOD: “I will also stretch out My hand against Edom, cut off man and beast from it, and make it desolate from Teman; Dedan shall fall by the sword.","Kră Yang khan: Inh gô yơ̆r ti Inh phak char Eđôm gô pơlôch đĭ bơngai păng lu sem dơrong noh; Inh gô pơm kơ char noh jing juơ đơ̆ng pơlei Thêman truh tơ pơlei Đêđan, lu sư gô pơ̆k lôch kơ đao."
"I will lay My vengeance on Edom by the hand of My people Israel, that they may do in Edom according to My anger and according to My fury; and they shall know My vengeance,” says the Lord GOD.","Inh gô yua ti kon pơlei Isơrael Inh; pơm 'mong blah char Eđôm kon pơlei noh gô pơm kơ char Êđôm kiơ̆ kơ tơdrong Inh hil mĭl păng Inh blĕk. Na lu sư gô băt kơ tơdrong Inh pơm 'mong, Kră Yang khan thoi noh."
"‘Thus says the Lord GOD: “Because the Philistines dealt vengefully and took vengeance with a spiteful heart, to destroy because of the old hatred,”","Kră Yang khan thoi âu: “Yua kơ kon pơlei Philistin pơm 'mong, pơm 'mong kiơ̆ kơ jơhngơ̆m areh ưh kơ đĭ đơ̆ng sơ̆ ki sơ̆ kach wă pơrăm char Juđa"
"therefore thus says the Lord GOD: “I will stretch out My hand against the Philistines, and I will cut off the Cherethites and destroy the remnant of the seacoast.","Kră Yang khan: Yua kơ thoi noh na Inh gô yơ̆r ti phak Philistin; Inh gô tơhiong đĭ bơngai Kôrêthit; păng gô pơlôch đĭ lu bơngai mă oei arih tơter đak dơsĭ."
"I will execute great vengeance on them with furious rebukes; and they shall know that I am the LORD, when I lay My vengeance upon them.” ’ ”","Inh gô phak pơrăm hăm tơdrong hil mĭl tih, mưh Inh pơm mong blah lu sư, na lu sư gô băt Inh boih Kră Yang.”"
"And it came to pass in the eleventh year, on the first day of the month, that the word of the LORD came to me, saying","Lăm sơnăm tăl mơjĭt-mônh, năr blŭng-a lăm khei, Kră Yang khan kơ inh"
"“Son of man, because Tyre has said against Jerusalem, ‘Aha! She is broken who was the gateway of the peoples; now she is turned over to me; I shall be filled; she is laid waste.’","“Ơ kon bơngai, yua kơ pơlei Tirơ pơma 'bơm gah Jêrusalem: “Ah ha! 'Măng jang lu kon pơlei pơla pơchah đĭ boih! Sư pơih ăn kơ inh boih; inh gô rai tih să, na sư răm đĭ bơih."
"“Therefore thus says the Lord GOD: ‘Behold, I am against you, O Tyre, and will cause many nations to come up against you, as the sea causes its waves to come up.","Thoi noh, Kră Yang khan: Ơ Tirơ! Âu, Inh wă phak ih. Inh gô ăn lơ teh đak iung blah ih, nhen thoi đak dơsĭ poh-yă."
"And they shall destroy the walls of Tyre and break down her towers; I will also scrape her dust from her, and make her like the top of a rock.","Lu sư gô pơrăm dur pơlei Tirơ păng teh pơchah lê̆ hnam gak kơjung. Inh gô hơpuih kôch pơgoh lu teh đơ̆ng lăm pơlei, lê̆ sư jing kông tơmo."
"It shall be a place for spreading nets in the midst of the sea, for I have spoken,’ says the Lord GOD; ‘it shall become plunder for the nations.","Sư gô jing anih đe sơ̆k hơnhuăl tŏk-bŏk đak dơsĭ; yua kơ Kră Yang khan: Inh khan boih sư jing tơmam lu dêh char đe blah tơgar iŏk."
"Also her daughter villages which are in the fields shall be slain by the sword. Then they shall know that I am the LORD.’","Lu kon pơlei sư oei tơ chŭn mir đe gô pơlôch hăm đao; păng lu sư gô băt Inh boih Kră Yang."
"“For thus says the Lord GOD: ‘Behold, I will bring against Tyre from the north Nebuchadnezzar king of Babylon, king of kings, with horses, with chariots, and with horsemen, and an army with many people.","Kră Yang khan thoi âu: Âu, Inh gô chông Nebukatnessar, pơtao Babilôn đơ̆ng gah yă-nơ̆m, pơtao kơ lu pơtao, hăm lu linh, lu linh hao aseh hăm lu linh hao gre aseh lơ, năm blah pơlei Tirơ."
"He will slay with the sword your daughter villages in the fields; he will heap up a siege mound against you, build a wall against you, and raise a defense against you.","Sư gô yua đao pơlôch lu kon pơlei ih tơ lăm chŭn mir, Sư gô bơ̆ bơnơ̆ ter dur păng hiŏng khêl blah ih."
"He will direct his battering rams against your walls, and with his axes he will break down your towers.","Lu sư gô yua gơ'beng bơsei pơrăm dur pơlei păng yua mut teh pơchah lu hnam gak kơjung ih."
"Because of the abundance of his horses, their dust will cover you; your walls will shake at the noise of the horsemen, the wagons, and the chariots, when he enters your gates, as men enter a city that has been breached.","Aseh lu sư lơ tơpă dĭng mah 'mui teh đơ̆ng jơ̆ng sư yak klơ̆p đĭ ih thoi hơmơ̆l. Lu dur pơlei ih pơpơ̆ yua kơ đơ̆ng tơtơ̆ng jơ̆ng lu linh hao aseh, lu linh gre aseh lu sư gô mơ̆t rok 'măng jang ih, nhen thoi mơ̆t lăm pơlei dur đe pơrăm đĭ bơih."
"With the hooves of his horses he will trample all your streets; he will slay your people by the sword, and your strong pillars will fall to the ground.","Kơchôp jơ̆ng aseh gô pơjuă pơrăm pơlei ih; lu sư gô pơlôch kon pơlei ih hăm đao, hăm lu jrăng kơjăp ih gô prưk păk tơ teh."
"They will plunder your riches and pillage your merchandise; they will break down your walls and destroy your pleasant houses; they will lay your stones, your timber, and your soil in the midst of the water.","Khŭl lu linh gô blah tơgar iŏk mŭk tơmam ih, iŏk đĭ dôm tơmam ih đei, pơrăm đĭ dur pơlei; lu sư gô pơrăm anih hnam 'lơ̆ng ih păng klơ̆m lê̆ lu tơmo, 'long păng teh ih tơ lăm đak dơsĭ."
"I will put an end to the sound of your songs, and the sound of your harps shall be heard no more.","Inh gô pơm kơ nơ̆r hơri ih kơtĕch, đe ưh pă kơtơ̆ng re brŏ dung ih dơ̆ng."
"I will make you like the top of a rock; you shall be a place for spreading nets, and you shall never be rebuilt, for I the LORD have spoken,’ says the Lord GOD.","Inh gô pơm kơ ih jing tơmo ih gô jing anih đe sơ̆k hơnhuăl; ưh pă đei gơh man pơdơ̆ng ming dơ̆ng; yua kơ Inh boih Kră Yang hlôi khan, Kră Yang khan thoi noh."
"“Thus says the Lord GOD to Tyre: ‘Will the coastlands not shake at the sound of your fall, when the wounded cry, when slaughter is made in the midst of you?","Kră Yang khan kơ pơlei Tirơ thoi âu: Kơtơ̆ng tơdrong ih pơchah răm lu bơngai jĭ ôr tơngưih, kơplah đe oei pơlôch tơ lăm ih, lu bŏl đak kơtơ̆ng thoi noh lu sư gô ưh kơ hli tơtơ̆ hă?"
"Then all the princes of the sea will come down from their thrones, lay aside their robes, and take off their embroidered garments; they will clothe themselves with trembling; they will sit on the ground, tremble every moment, and be astonished at you.","Đĭ-đăng lu yŏng lăm dêh char jê̆ đak dơsĭ, gô jur đơ̆ng tang-dŏ lu sư. Plôh ao tai păng hơleh hŭt lu ao reng. Lu sư pŭ iŏk tơdrong hli tơrơ păng oei tơ ala teh tơtơ̆. Lu sư gô hli yua kơ tơdrong truh tơ ih."
"And they will take up a lamentation for you, and say to you: “How you have perished, O one inhabited by seafaring men, O renowned city, Who was strong at sea, She and her inhabitants, Who caused their terror to be on all her inhabitants!","Lu sư nhơ̆m hmoi kơ ih păng khan kơ ih: Ơ pơlei mă đei ư-ang liơ ih răm đĭ, pơlei lu bơngai mă oei tơ đak dơsĭ, ih păng lu kon pơlei ih oei kơjăp mơdrŏng lăm đak dơsĭ. Ih păng đĭ-đăng bơngai tơ noh pơm kơ đe hli."
"Now the coastlands tremble on the day of your fall; Yes, the coastlands by the sea are troubled at your departure.” ’","Dang ei lu bơngai oei jih đak dơsĭ hli tơrơ lăm năr ih răm pơchah păng lu bŏl lăm đak dơsĭ tơtơ̆ tơtey yua kơ ih răm rai đĭ."
"“For thus says the Lord GOD: ‘When I make you a desolate city, like cities that are not inhabited, when I bring the deep upon you, and great waters cover you","'Nâu nơ̆r Kră Yang khan: Mưh Inh pơm kơ ih jing juơ tơtŭng, nhen thoi pơlei ưh kơ đei bơngai oei: Mưh Inh ba anih jrŭ păng đak tih lơ̆p ih"
"then I will bring you down with those who descend into the Pit, to the people of old, and I will make you dwell in the lowest part of the earth, in places desolate from antiquity, with those who go down to the Pit, so that you may never be inhabited; and I shall establish glory in the land of the living.","Kơplah noh Inh gô tơjur ih tơ lăm sơlŭng jrŭ hơdai hăm kon pơlei oei chăl sơ̆. Inh gô ăn kơ ih oei tơ anih jrŭ lăm teh sŭng hơdai hăm lu bơngai răm rai chăl sơ̆. Thoi noh, na kon pơlei ưh pă đei oei lăm ih dơ̆ng; ih kư̆m ưh kơ đei oei lăm teh lu bơngai arih mơ̆n."
"I will make you a terror, and you shall be no more; though you are sought for, you will never be found again,’ says the Lord GOD.”","Inh gô chông ih tơ anih đei tơdrong pơmat-tat, hli krưp. Ih gô ưh pă đei dơ̆ng; mă đe chă ih, pă 'bôh ih dơ̆ng. Kră Yang khan thoi noh."
"The word of the LORD came again to me, saying","Kră Yang khan kơ inh"
"“Now, son of man, take up a lamentation for Tyre","“Ơ kon bơngai, nhơ̆m hmoi bĕ kơ pơlei Tirơ."
"and say to Tyre, ‘You who are situated at the entrance of the sea, merchant of the peoples on many coastlands, thus says the Lord GOD: “O Tyre, you have said, ‘I am perfect in beauty.’","Khan bĕ kơ pơlei Tirơ: Ih jing pơlei oei trong 'măng jang đak dơsĭ, mơdro sa hăm lơ pơlei oei lăm bŏl dơsĭ: Kră Yang khan thoi âu: ‘Ơ Tirơ, ih đei khan: Inh 'lơ̆ng hơbŏ tôm tĕch."
"Your borders are in the midst of the seas. Your builders have perfected your beauty.","Anih teh ih tơ tŏk-bŏk đak dơsĭ; lu bơngai mă pơdơ̆ng pơjing ih pơm kơ ih jing 'lơ̆ng hơiă."
"They made all your planks of fir trees from Senir; They took a cedar from Lebanon to make you a mast.","Đe yua tơ̆r 'long hơngo hmă đơ̆ng kông sênir pơm akâu thŏng-nan ih iŏk 'long hơngo đơ̆ng Liban pơm jrăng chô̆ che thŏng-nan ih"
"Of oaks from Bashan they made your oars; The company of Ashurites have inlaid your planks With ivory from the coasts of Cyprus.","iŏk 'long kôih đơ̆ng char 'Basan pơm 'long huơ̆r iŏk 'long hơngo hmă đơ̆ng bŏl dơsĭ Kitim lơ̆k hơnă, lom hăm bơla rôih."
"Fine embroidered linen from Egypt was what you spread for your sail; Blue and purple from the coasts of Elishah was what covered you.","Che rơmuăn đei reng đơ̆ng Êyiptơ dăng pĕng kial, thoi hla-kơ, che pơm yơ̆p noh hăm che dreng jơk hơhĭm đơ̆ng bŏl đak dơsĭ Êlisa."
"“Inhabitants of Sidon and Arvad were your oarsmen; Your wise men, O Tyre, were in you; They became your pilots.","Kon pơlei Siđôn păng Arwat bơngai hơwơ̆r kơ ih; ơ pơlei Tirơ, lu bơngai hơgei lăm ih jing bơngai gơh huơ̆r oei hăm ih."
"Elders of Gebal and its wise men Were in you to caulk your seams; All the ships of the sea And their oarsmen were in you To market your merchandise.","Lu bơngai gơh hơmet păng lu bơngai hơgei đơ̆ng pơlei Gebal oei hơdai ih wă hơmet ming lu thŏng-nan răm. Đĭ-đăng lu thŏng-nan păng lu bơngai huơ̆r năm tơ ih, lăm chă mơdro tơplih băl tơmam."
"“Those from Persia, Lydia, and Libya Were in your army as men of war; They hung shield and helmet in you; They gave splendor to you.","Lu bơngai char Pherơsơ, bơngai char Lŭt, bơngai char Phŭt lăm khŭl, linh ih, lu sư jing linh nuih kơtang lu sư hơtol khêl păng môk tơblah 'bơ̆t tơnăr ih, lu sư ba tơdrong ư-ang kơ ih."
"Men of Arvad with your army were on your walls all around, And the men of Gammad were in your towers; They hung their shields on your walls all around; They made your beauty perfect.","Lu bơngai pơlei Arwat hăm lu linh Hêlek oei tơ kơpal tơnăr tăp dăr lu bơngai Gamat gak rim hnam gak. Lu sư hơtol khêl jum dăr kơ tơnăr pơm kơ ih jing 'lơ̆ng hơbŏ."
"“Tarshish was your merchant because of your many luxury goods. They gave you silver, iron, tin, and lead for your goods.","Lu bơngai char Tarêsi mơdro hăm ih yua kơ ih đei tôm tơmam, lu sư iŏk hu, mam, kem, bơlơ̆k tơplih iŏk tơmam ih."
"Javan, Tubal, and Meshech were your traders. They bartered human lives and vessels of bronze for your merchandise.","Lu bơngai char Jawan, Tubal păng Mêsêk mơdro hăm ih, lu sư iŏk kong, iŏk lu bơngai đĭch tơplih iŏk tơmam đơ̆ng ih."
"Those from the house of Togarmah traded for your wares with horses, steeds, and mules.","Lu bơngai pơlei Tôgama iŏk seh tơblah păng aseh iĕ iŏk tơplih tơmam đơ̆ng ih."
"The men of Dedan were your traders; many isles were the market of your hand. They brought you ivory tusks and ebony as payment.","Lu bơngai pơlei Đêđan tĕch mơdro hăm ih, kon pơlei mă đei lơ bŏl teh lăm dơsĭ kư̆m tĕch mơdro hăm ih. Lu sư chĕp ba bơla rôih hăm 'long gơnhum tơplih tơmam ih."
"Syria was your merchant because of the abundance of goods you made. They gave you for your wares emeralds, purple, embroidery, fine linen, corals, and rubies.","Lu bơngai char Siri mơdro hăm ih yua kơ ih đei mŭk tơmam lơ; lu sư iŏk tơmo jơmŏng, che rang, tơmam reng, che 'bui, che brai se, tơmo gĭt tơplih iŏk tơmam ih."
"Judah and the land of Israel were your traders. They traded for your merchandise wheat of Minnith, millet, honey, oil, and balm.","Char Juđa păng teh đak Isơrael mơdro sa hăm ih; lu sư tĕch 'ba mi, 'ba tơ'bâu, 'bĕng 'ngam, đak sut, đak rơmă ôliwơ păng pơgang 'bâu phu wă tơplih iŏk tơmam ih"
"Damascus was your merchant because of the abundance of goods you made, because of your many luxury items, with the wine of Helbon and with white wool.","Yua kơ ih pơjing đei mŭk tơmam tôm tĕch rơkah rơkai, na pơlei Đamach mơdro sa hăm ih, sư iŏk sik hơmu đơ̆ng Hêlbôn păng iŏk sŏk triu kok đơ̆ng pơlei sahar lu sư wă tơplih hăm tơmam ih."
"Dan and Javan paid for your wares, traversing back and forth. Wrought iron, cassia, and cane were among your merchandise.","Bơngai Wêđan păng Jawan răt tơmam đơ̆ng Usal năm răt tơplih tơmam ih; chĕp ba đei mam, 'long hol 'long Kasa, 'long 'bâu phu."
"Dedan was your merchant in saddlecloths for riding.","Lu bơngai Đêđan mơdro hăm ih lu khăn pơm an aseh."
"Arabia and all the princes of Kedar were your regular merchants. They traded with you in lambs, rams, and goats.","Lu bơngai Arap păng lu yŏng tih tơring Kêđa mơdro hăm ih păng tĕch mơdro kơ ih triu kon, triu tơno păng bơbe bram."
"The merchants of Sheba and Raamah were your merchants. They traded for your wares the choicest spices, all kinds of precious stones, and gold.","Lu bơngai mơdro đơ̆ng pơlei Sêba păng pơlei Raama mơdro hăm ih, iŏk lu tơmam 'lơ̆ng gĭt, đĭ-đăng lu tơmo gĭt păng maih tơplih iŏk tơmam ih."
"Haran, Canneh, Eden, the merchants of Sheba, Assyria, and Chilmad were your merchants.","Bơngai mơdro đơ̆ng lu pơlei Haran, Kannê păng Êđen, Sêba, Asur păng Kilmat bơngai mơdro sa hăm ih."
"These were your merchants in choice items—in purple clothes, in embroidered garments, in chests of multicolored apparel, in sturdy woven cords, which were in your marketplace.","Lu sư mơdro hăm ih lu hơbĕn ao tơpă kăp jên, che hơhĭm, che brai dônh păng ao reng, che lơ̆k hơnă đe tanh hăm lơ đak 'brê jơk păng tơlei kŭi kơjăp."
"“The ships of Tarshish were carriers of your merchandise. You were filled and very glorious in the midst of the seas.","Lu duk đơ̆ng Tarêsi chơ tơmam mơdro ăn kơ ih na ih đei lơ tơmam rơkah rơkai păng chơ trăp tơpă lăm đak dơsĭ."
"Your oarsmen brought you into many waters, But the east wind broke you in the midst of the seas.","Lu bơngai huơ̆r kơ ih, ba ih lăm đak dơsĭ păng kial đơ̆ng gah hơlĕch bah pơrăm ih tơ lăm tŏk-bŏk đak dơsĭ."
"“Your riches, wares, and merchandise, Your mariners and pilots, Your caulkers and merchandisers, All your men of war who are in you, And the entire company which is in your midst, Will fall into the midst of the seas on the day of your ruin.","Lu mŭk tơmam ih, tơmam mơdro mơchan ih bơngai huơ̆r duk, thơ̆ hơmet, bơngai mơdro, đĭ-đăng lu linh ih, hăm đĭ-đăng lu bơngai lăm thŏng-nan gô hiong răm môch lăm đak dơsĭ đĭ 'bơ̆t năr tơdrong răm truh kơ ih."
"The common-land will shake at the sound of the cry of your pilots.","Kơtơ̆ng lu bơngai huơ̆r ôr krao, lu kon pơlei tơring jum dăr kơ ih hli tơtơ̆."
"“All who handle the oar, The mariners, All the pilots of the sea Will come down from their ships and stand on the shore.","Đĭ-đăng lu bơngai huơ̆r duk, lu bơngai bơ̆jang, lu bơngai hơmet jur đĭ đơ̆ng duk tŏk đĭ tơ kông jih đak dơsĭ."
"They will make their voice heard because of you; They will cry bitterly and cast dust on their heads; They will roll about in ashes","Lu sư gô nhơ̆m hmoi păng ơh sơ'ngon kơ ih, chup 'mui teh klă tơ kơ̆l kơdih păng tơglăng lăm tơnuh."
"They will shave themselves completely bald because of you, Gird themselves with sackcloth, And weep for you With bitterness of heart and bitter wailing.","Lu sư gô hơkôih kơ̆l 'ngôch, hrŭk su 'bi sơ'ngon yua kơ ih, jĭ jơhngơ̆m ơh sơ'ngon nhơ̆m hmoi ơh ol."
"In their wailing for you They will take up a lamentation, And lament for you: ‘What city is like Tyre, Destroyed in the midst of the sea?","Kơplah nhơ̆m hmoi 'mêm kơeng lu sư hmoi jô̆ sơ'ngon kơ ih, hmoi thoi âu: Bu đei tơdrong truh thoi pơlei Tirơ, môch hiong biŏng lăm đak dơsĭ?"
"‘When your wares went out by sea, You satisfied many people; You enriched the kings of the earth With your many luxury goods and your merchandise.","Kơplah ih chơ tơmam rok đak dơsĭ sơ̆. Ih pơm kơ lơ kon pơlei hiôk jơnap. Kơ tơmam lơ mah rơkah rơkai, ih pơm ăn mơdrŏng kơ lu pơtao lăm teh đak."
"But you are broken by the seas in the depths of the waters; Your merchandise and the entire company will fall in your midst.","Dang ei hlôi răm krăm hiong lăm đak dơsĭ, mŭk drăm mơdro mơchan păng kon pơlei oei hơdai hăm ih kư̆m môch hiong hăm ih."
"All the inhabitants of the isles will be astonished at you; Their kings will be greatly afraid, And their countenance will be troubled.","Đĭ-đăng kon pơlei oei lăm lu bŏl đak dơsĭ, lăng hlĭch chrêu tơpă yua kơ tơdrong truh kơ ih; pơtao lu sư hli tơrơ dêh muh măt lu sư hơ'brơ̆p hơ'brăp."
"The merchants among the peoples will hiss at you; You will become a horror, and be no more forever.’ ” ’ ”","Lu bơngai mơdro mơchan hăm ih lăm teh đak, hơhôch tơhuăi ih, yua kơ ih đĭ hiong tôch krưp tơpă. Ih jing pă đei dơ̆ng hiong hlŏng hloi truh tơ ning-mônh.’ ”"
"The word of the LORD came to me again, saying","Kră Yang khan kơ inh"
"“Son of man, say to the prince of Tyre, ‘Thus says the Lord GOD: “Because your heart is lifted up, And you say, ‘I am a god, I sit in the seat of gods, In the midst of the seas,’ Yet you are a man, and not a god, Though you set your heart as the heart of a god","“Ơ kon bơngai, khan bĕ kơ pơtao Tirơ: Kră Yang khan thoi âu; yua kơ jơhngơ̆m ih pơang, ih khan: “Inh jing yang hơ-oei kơpal tang-dŏ pơtao yang lăm tŏk-bŏk đak dơsĭ,” mă-lei ih kon bơngai đĕch, ưh kơ sĭ yang ôh mă khan ih tơchĕng khan ih hơgei thoi yang."
"(Behold, you are wiser than Daniel! There is no secret that can be hidden from you!","“Âu, ih hơgei hloh kơ Đaniel; ưh kơ đei tơdrong kiơ gơh ôn kơ ih!"
"With your wisdom and your understanding You have gained riches for yourself, And gathered gold and silver into your treasuries","Đơ̆ng tơdrong gơh hơgei hlôh wao, ih pơjing sa đei mŭk tơmam; ih kư̆m mong 'măn hu maih lăm hnam mong tơmam."
"By your great wisdom in trade you have increased your riches, And your heart is lifted up because of your riches),”","Đơ̆ng tơdrong gơh hơgei mơdro sa noh ih jing mơdrŏng tih thoi noh na jơhngơ̆m ih pơang yua kơ ih mơdrŏng tih."
"‘Therefore thus says the Lord GOD: “Because you have set your heart as the heart of a god","Na Kră Yang khan thoi âu: Yua kơ ih khan jơhngơ̆m đon ih hơgei thoi jơhngơ̆m đon lu yang."
"Behold, therefore, I will bring strangers against you, The most terrible of the nations; And they shall draw their swords against the beauty of your wisdom, And defile your splendor.","Inh gô ăn lu teh đak nai năm blah ih lu kon pơlei mă pran kơtang hloh lăm lu dêh char iung blah ih; lu sư gô iŏk đao blah tơdrong hơgei păng tơdrong 'lơ̆ng rŏ ih, păng pơm 'mê̆ kơ tơdrong ư-ang ih."
"They shall throw you down into the Pit, And you shall die the death of the slain In the midst of the seas.","Lu sư gô tơlơ̆ ih lăm sơlŭng jrŭ păng ih gô lôch hăm tơdrong lôch krưp dêh lăm đak dơsĭ."
"“Will you still say before him who slays you, ‘I am a god’? But you shall be a man, and not a god, In the hand of him who slays you.","'Bơ̆t anăp lu bơngai pơlôch ih, ih hăm pơ̆n pơma; “Inh âu yang?” Tơpă ih bơngai đĕch, ưh kơ sĭ yang ôh, lăm ti lu bơngai pơlôch ih."
"You shall die the death of the uncircumcised By the hand of aliens; For I have spoken,” says the Lord GOD.’ ”","Ih gô lôch nhen thoi bơngai tam mă kăt tơdra akar. Lăm ti lu bơngai tơmoi, yua kơ Inh khan boih, Kră Yang khan.’”"
"Moreover the word of the LORD came to me, saying","Kră Yang khan kơ inh"
"“Son of man, take up a lamentation for the king of Tyre, and say to him, ‘Thus says the Lord GOD: “You were the seal of perfection, Full of wisdom and perfect in beauty.","“Ơ kon bơngai, nhơ̆m hmoi kơ pơtao Tirơ bĕ khan kơ sư: ‘Kră Yang khan thoi âu: Ih bơngai đei tôm tơdrong gơh hơgei, 'lơ̆ng rŏ."
"You were in Eden, the garden of God; Every precious stone was your covering: The sardius, topaz, and diamond, Beryl, onyx, and jasper, Sapphire, turquoise, and emerald with gold. The workmanship of your timbrels and pipes Was prepared for you on the day you were created.","Ih oei tơ pơgar Êđen, pơgar Kră Yang 'Bok Kei-Dei. Ih pơguăng hăm tơmam tơmo gĭt thoi jơmŏng tơmo jasper, tơmo saphirê, tơmo Shơkêđô tơmo samarađô, tơmo siađô, tơmo krisôlia, tơmo borelô, tơmo tôpasiô, ih hling hrâu hăm maih dơ̆ng. Đơ̆ng năr mă đei pơjing ih đei hơmet lê̆ boih dôm tơmam noh."
"“You were the anointed cherub who covers; I established you; You were on the holy mountain of God; You walked back and forth in the midst of fiery stones.","Đe tuh kơ ih đak rơmă wă pơm chêrubim gak bơwei. Inh dan ih tơ kơpal kông rơgoh Kră Yang 'Bok Kei-Dei; ih yak năm tŏk-bŏk jơmŏng rang hơdah thoi ŭnh."
"You were perfect in your ways from the day you were created, Till iniquity was found in you.","Đơ̆ng năr pơjing kơ ih, trong ih yak đe ưh kơ đei wă gơh chrih dĭng tơ năr 'bôh tơdrong kơnê̆ truh tơ ih."
"“By the abundance of your trading You became filled with violence within, And you sinned; Therefore I cast you as a profane thing Out of the mountain of God; And I destroyed you, O covering cherub, From the midst of the fiery stones.","Đơ̆ng ih mơdro sa tih đei mơdrŏng ih pơm kơnê̆ păng yoch; thoi noh na, ơ chêrubim gak bơwei, Inh puh lê̆ ih đơ̆ng kông Kră Yang 'Bok Kei-Dei; păng pơlôch ih đơ̆ng lu jơmŏng rang hơdah thoi ŭnh."
"“Your heart was lifted up because of your beauty; You corrupted your wisdom for the sake of your splendor; I cast you to the ground, I laid you before kings, That they might gaze at you.","Jơhngơ̆m ih pơang yua kơ ih 'lơ̆ng. Tơdrong ư-ang ih pơm kơ ih hiong răm tơdrong gơh hơgei. Inh klơ̆m hŭt ih tơ teh 'bơ̆t anăp lu pơtao, Inh jao ih wă ăn kơ lu sư lăng."
"“You defiled your sanctuaries By the multitude of your iniquities, By the iniquity of your trading; Therefore I brought fire from your midst; It devoured you, And I turned you to ashes upon the earth In the sight of all who saw you.","Đơ̆ng tơdrong yoch păng mơdro sa hơlĕnh, ih pơm pơ'mê̆ kơ anih rơgoh ih. Yua kơ thoi noh Inh gô ăn ŭnh lĕch đơ̆ng tŏk-bŏk ih wă soh ih păng wă pơm kơ ih jing thoi tơnuh kơpal teh 'bơ̆t anăp lu bơngai gô lăng."
"All who knew you among the peoples are astonished at you; You have become a horror, And shall be no more forever.” ’ ”","Đĭ-đăng lu bơngai lăm lu adrĕch drung băt kơ ih, gô lăng ih chrơp. Ih gô truh tơ anih tôch krưp tơpă. Ih jing pă đei dơ̆ng tơ̆p ning-mônh.’ ”"
"Then the word of the LORD came to me, saying","Kră Yang khan kơ inh"
"“Son of man, set your face toward Sidon, and prophesy against her","“Ơ kon bơngai tơwih bĕ muh măt ih gah pơlei Siđôn, khan lê̆ adrol blah sư."
"and say, ‘Thus says the Lord GOD: “Behold, I am against you, O Sidon; I will be glorified in your midst; And they shall know that I am the LORD, When I execute judgments in her and am hallowed in her.","Khan bĕ kơ sư: Kră Yang khan thoi âu: Ơ pơlei Siđôn, âu, Inh blah ih; Inh wă kơ đei ư-ang lăm ih. Lu sư gô băt inh boih Kră Yang, kơplah inh sek tơlang phak ih wă tơ'bôh tơdrong rơgoh Inh."
