English, Bahnar
"Why will you die, you and your people, by the sword, by the famine, and by the pestilence, as the LORD has spoken against the nation that will not serve the king of Babylon?","Yua kơ kiơ ih păng lu kon pơlei ih lê̆ đe pơlôch iĕm hăm đao gưm, pơngot rơwĕt, lôch hơbuh thoi Kră Yang đei khan kơ dêh char ayơ mă ưh kơ wă chu kiơ̆ kơ pơtao Babilôn?"
"Therefore do not listen to the words of the prophets who speak to you, saying, ‘You shall not serve the king of Babylon,’ for they prophesy a lie to you","Apinh iĕm 'nĕ kơ mơ̆ng hŏ dôm nơ̆r lu bơngai khan lê̆ adrol khan: ‘Lu iĕm huay kơ chu jang kơ pơtao Babilôn. Noh tơdrong hơlĕnh đĕch mă lu sư khan lê̆ adrol kơ lu iĕm.”"
"for I have not sent them,” says the LORD, “yet they prophesy a lie in My name, that I may drive you out, and that you may perish, you and the prophets who prophesy to you.”","Kră Yang khan: “Inh ưh kơ đei wơh lu sư, lu sư yua anăn Inh khan lê̆ adrol hơlĕnh. Tơdah lui kơ lu sư Inh gô pơpuh tơweh lu iĕm păng pơlôch pơđĭ lu iĕm păng lu bơngai khan lê̆ adrol noh.”"
"Also I spoke to the priests and to all this people, saying, “Thus says the LORD: ‘Do not listen to the words of your prophets who prophesy to you, saying, “Behold, the vessels of the LORD’s house will now shortly be brought back from Babylon”; for they prophesy a lie to you.","Inh kư̆m khan kơ lu 'bok soi păng đĭ-đăng kon pơlei âu: “Kră Yang khan: ‘'Nĕ pă mơ̆ng nơ̆r lu bơngai khan lê̆ adrol kơ iĕm khan: Dôm lu tơmam yua lăm hnam Kră Yang ưh pă đunh boih Babilôn gô pơdrâu tơwih tơ âu! Noh lu sư khan lê̆ adrol hơlĕnh kơ lu iĕm."
"Do not listen to them; serve the king of Babylon, and live! Why should this city be laid waste?","'Nĕ pă mơ̆ng lu đe noh, chu jang bĕ kơ pơtao Babilôn wă kơ iĕm gơh arih. Liơ pơlei tih âu pơchah răm?"
"But if they are prophets, and if the word of the LORD is with them, let them now make intercession to the LORD of hosts, that the vessels which are left in the house of the LORD, in the house of the king of Judah, and at Jerusalem, do not go to Babylon.’","Dah lu sư bơngai khan lê̆ adrol tơpă păng đei nơ̆r Kră Yang, lei lê̆ lu sư krao khan apinh Kră Yang Tih Hloh, wă kơ tơmam gĭt oei oei lăm hnam Kră Yang, lăm hnam pơtao Juđa păng pơlei tih Jêrusalem, đe huay kơ iŏk ba tơ char Babilôn."
"“For thus says the LORD of hosts concerning the pillars, concerning the Sea, concerning the carts, and concerning the remainder of the vessels that remain in this city","Yua kơ Kră Yang Tih Hloh khan trŏ kơ lu jrăng păng kong, bơng đak tih krao dơsĭ kong, păng jơ̆ng hăm kong đei tang-wang wă tŭn lu bơng, păng dôm tơmam gĭt oei đei lăm pơlei"
"which Nebuchadnezzar king of Babylon did not take, when he carried away captive Jeconiah the son of Jehoiakim, king of Judah, from Jerusalem to Babylon, and all the nobles of Judah and Jerusalem","lu tơmam mă Nebukatnessar pơtao đe Babilôn ưh kơ tung ba, kơplah sư rôp ba Jêkônia kon drŏ-nglo Jêhôiakim, pơtao đe Juđa, hơdai hăm lu kră pơgơ̆r char Juđa đơ̆ng pơlei tih Jêrusalem, ba tơ char Babilôn pơm bơnă"
"yes, thus says the LORD of hosts, the God of Israel, concerning the vessels that remain in the house of the LORD, and in the house of the king of Judah and of Jerusalem","Kră Yang Tih Hloh, 'Bok Kei-Dei bơngai Isơrael khan kơ tơmam gĭt oei oei lăm hnam akŭm, lăm hnam pơtao đe Juđa păng pơlei tih Jêrusalem"
"‘They shall be carried to Babylon, and there they shall be until the day that I visit them,’ says the LORD. ‘Then I will bring them up and restore them to this place.’ ”","‘Gô iŏk ba tơ char Babilôn păng 'măn lê̆ tơ noh dĭng truh năr Inh athei lu sư 'ba pơdrâu tơ anih 'nâu.” Noh Kră Yang khan!"
"And it happened in the same year, at the beginning of the reign of Zedekiah king of Judah, in the fourth year and in the fifth month, that Hananiah the son of Azur the prophet, who was from Gibeon, spoke to me in the house of the LORD in the presence of the priests and of all the people, saying","Lăm sơnăm noh mơ̆n wă khan, lăm chăl Sêđekia 'nao pơtơm pơm pơtao đe Juđa, lăm khei pơđăm sơnăm mă puăn, Hanania kon drŏ-nglo Asur, bơngai khan lê̆ adrol đơ̆ng pơlei Gibeôn, pơma hăm inh lăm hnam Kră Yang 'bơ̆t anăp lu 'bok soi păng đĭ kon pơlei"
"“Thus speaks the LORD of hosts, the God of Israel, saying: ‘I have broken the yoke of the king of Babylon.","Kră Yang Tih Hloh, 'Bok Kei-Dei bơngai Isơrael khan: “Inh gơ̆ lê̆ boih 'long ăt pơtao Babilôn."
"Within two full years I will bring back to this place all the vessels of the LORD’s house, that Nebuchadnezzar king of Babylon took away from this place and carried to Babylon.","Lăm 'bar sơnăm đơ̆ng rŏng, dôm tơmam gĭt lăm hnam Kră Yang mă đêl Nebukatnessar pơtao Babilôn iŏk đơ̆ng anih âu ba tơ char Babilôn, na Inh gô iŏk pơdrâu tơ anih âu.’ ”"
"And I will bring back to this place Jeconiah the son of Jehoiakim, king of Judah, with all the captives of Judah who went to Babylon,’ says the LORD, ‘for I will break the yoke of the king of Babylon.’ ”","Kră Yang khan: “Inh gô ba brŏk Jêkônia kon drŏ-nglo Jêhôiakim pơtao đe Juđa păng đĭ-đăng lu bơngai Juđa mă đe rôp pơm bơnă tơ Babilôn, kư̆m brŏk tơ anih âu dơ̆ng; yua kơ Inh gơ̆ lê̆ boih 'long ăt pơtao Babilôn.”"
"Then the prophet Jeremiah spoke to the prophet Hananiah in the presence of the priests and in the presence of all the people who stood in the house of the LORD","Na, Jêrêmi tơl hloi Hanania 'bok khan lê̆ adrol 'bơ̆t anăp lu 'bok soi păng kon pơlei oei dơ̆ng lăm hnam Kră Yang."
"and the prophet Jeremiah said, “Amen! The LORD do so; the LORD perform your words which you have prophesied, to bring back the vessels of the LORD’s house and all who were carried away captive, from Babylon to this place.","Jêrêmi 'bok khan lê̆ adrol khan: “Trŏ tơpă apinh Kră Yang pơm bĕ thoi noh; apinh Kră Yang pơm bĕ trŏ thoi nơ̆r ih đei khan lê̆ adrol wă iŏk pơdrâu đĭ đêl dôm tơmam gĭt lăm hnam Kră Yang păng chông ba brŏk đĭ-đăng lu bơngai Juđa đêl pơm bơnă đơ̆ng lăm char Babilôn wih tơ anih âu!"
"Nevertheless hear now this word that I speak in your hearing and in the hearing of all the people","Lei na mơ̆ng bĕ nơ̆r inh wă pơma hăm ih păng đĭ-đăng kon pơlei pơla âu."
"The prophets who have been before me and before you of old prophesied against many countries and great kingdoms—of war and disaster and pestilence.","Lu 'bok khan lê̆ adrol, adrol kơ ih hăm adrol kơ inh, đơ̆ng sơ̆ lu sư khan lê̆ adrol boih kơ tơdrong tơblah wang, tơdrong pơrăm, jĭ lôch hơbuh, pơngot rơwĕt, truh tơ lơ dêh char păng tơ lăm dêh char tih."
"As for the prophet who prophesies of peace, when the word of the prophet comes to pass, the prophet will be known as one whom the LORD has truly sent.”","Mă-lei 'bok khan lê̆ adrol ayơ khan hiôk-hian rơnŭk rơnua, dah nơ̆r sư khan noh trŏ 'blep tơpă, 'bok noh đe băt kơ sư noh đơ̆ng Kră Yang wơh tơpă!”"
"Then Hananiah the prophet took the yoke off the prophet Jeremiah’s neck and broke it.","Hanania 'bok khan lê̆ adrol plôh iŏk 'long ăt đơ̆ng ako Jêrêmi 'bok khan lê̆ adrol păng gơ̆ lê̆."
"And Hananiah spoke in the presence of all the people, saying, “Thus says the LORD: ‘Even so I will break the yoke of Nebuchadnezzar king of Babylon from the neck of all nations within the space of two full years.’ ” And the prophet Jeremiah went his way.","Đơ̆ng noh, Hanania tơbăt 'bơ̆t anăp đĭ kon pơlei: “Kră Yang khan: 'Blep lăm 'bar sơnăm Inh gô gơ̆ lê̆ 'long ăt Nebukatnessar pơtao đe Babilôn đơ̆ng ako rim kơ adrĕch adrung.’ ” Jêrêmi 'bok khan lê̆ adrol yak brŏk."
"Now the word of the LORD came to Jeremiah, after Hananiah the prophet had broken the yoke from the neck of the prophet Jeremiah, saying","Đơ̆ng rŏng kơ Hanania plôh lê̆ boih 'long ăt đơ̆ng ako Jêrêmi, đei nơ̆r Kră Yang khan kơ Jêrêmi"
"“Go and tell Hananiah, saying, ‘Thus says the LORD: “You have broken the yokes of wood, but you have made in their place yokes of iron.”","Ih năm khan bĕ kơ Hanania: Kră Yang khan: Ih gơ̆ lê̆ boih 'long ăt pơm păng 'long đơ̆ng Jêrêmi mă-lei Inh gô tơ'băk ăn kôih 'long ăt pơm păng bơsei.”"
"For thus says the LORD of hosts, the God of Israel: “I have put a yoke of iron on the neck of all these nations, that they may serve Nebuchadnezzar king of Babylon; and they shall serve him. I have given him the beasts of the field also.” ’ ”","'Nâu Kră Yang Tih Hloh, 'Bok Kei-Dei bơngai Isơrael khan: Inh gô tơ'băk 'long ăt păng bơsei tơ ako rim adrĕch adrung âu, wă kơ lu sư pơm đĭch kơ Nebukatnessar pơtao Babilôn păng chu jang kơ sư, mă lu sem bri Inh kư̆m đei jao boih kơ sư.”"
"Then the prophet Jeremiah said to Hananiah the prophet, “Hear now, Hananiah, the LORD has not sent you, but you make this people trust in a lie.","Đơ̆ng noh Jêrêmi 'bok khan lê̆ adrol khan kơ Hanania 'bok khan lê̆ adrol: “Ơ Hanania, mơ̆ng bĕ, Kră Yang ưh kơ đei wơh ih ôh, mă-lei ih pơm kơ kon pơlei 'nâu gơnang kơ nơ̆r ih hơlĕnh."
"Therefore thus says the LORD: ‘Behold, I will cast you from the face of the earth. This year you shall die, because you have taught rebellion against the LORD.’ ”","Thoi noh, Kră Yang khan: 'Nâu; Inh gô ba ih weh đơ̆ng kơpal teh âu; sơnăm âu ih gô lôch; yua kơ ih đei pơma iung blah hăm Kră Yang.”"
"So Hananiah the prophet died the same year in the seventh month.","Lăm sơnăm noh hloi khei tơpơh, Hanania 'bok khan lê̆ adrol lôch."
"Now these are the words of the letter that Jeremiah the prophet sent from Jerusalem to the remainder of the elders who were carried away captive—to the priests, the prophets, and all the people whom Nebuchadnezzar had carried away captive from Jerusalem to Babylon.","'Nâu nơ̆r Jêrêmi đơ̆ng pơlei Jêrusalem chih gơih kơ lu đe kră mă oei arih, lu đe 'bok soi, lu 'bok khan lê̆ adrol păng đĭ-đăng kon pơlei mă pơtao Nebukatnessar rôp đơ̆ng pơlei Jêrusalem ba tơ char Babilôn pơm bơnă."
"(This happened after Jeconiah the king, the queen mother, the eunuchs, the princes of Judah and Jerusalem, the craftsmen, and the smiths had departed from Jerusalem.)","Đơ̆ng rŏng kơ pơtao Jêkônia, mĕ pơtao, lu bơngai jang lăm hnam pơtao, lu kră pơgơ̆r đơ̆ng Juđa păng Jêrusalem, lu thơ̆ hơgei gơh pơm lĕch đơ̆ng pơlei Jêrusalem boih"
"The letter was sent by the hand of Elasah the son of Shaphan, and Gemariah the son of Hilkiah, whom Zedekiah king of Judah sent to Babylon, to Nebuchadnezzar king of Babylon, saying","kơthơ noh Jêrêmi hơtă ăn kơ bre Êlasa kon drŏ-nglo Saphan păng Gêmaria kon drŏ-nglo Hilkia mă Sêđekia pơtao đe Juđa wơh bre sư năm tơ char Babilôn tơ'bơ̆p Nebukatnessar pơtao đe Babilôn. Kơthơ noh chih khan"
"Thus says the LORD of hosts, the God of Israel, to all who were carried away captive, whom I have caused to be carried away from Jerusalem to Babylon","Kră Yang Tih Hloh, 'Bok Kei-Dei bơngai Isơrael khan kơ lu bơngai mă Inh ăn đe rôp pơm bơnă đơ̆ng pơlei Jêrusalem ba tơ Babilôn"
"Build houses and dwell in them; plant gardens and eat their fruit.","“Pơm bĕ hnam oei, pơtăm bĕ 'long sa plei lăm mir pơgar, na phĕ sa plei sư."
"Take wives and beget sons and daughters; and take wives for your sons and give your daughters to husbands, so that they may bear sons and daughters—that you may be increased there, and not diminished.","Iŏk bĕ klo akăn, na pơjing kon drŏ-nglo drŏ-kăn; chă ăn bĕ kơ lu kon tơdăm iĕm akăn, ăn bĕ kơ lu kon adruh iĕm đei klo, wă kơ lu sư pơjing kon hơ'lơ̆p, drŏ-nglo dah drŏ-kăn, wă kơ đei kon sâu rai lơ tơ noh, 'nĕ pă hrŏ hiong."
"And seek the peace of the city where I have caused you to be carried away captive, and pray to the LORD for it; for in its peace you will have peace.","Chă bĕ tơdrong hiôk-hian jơnap kơ pơlei tih mă Inh đei ăn kơ lu iĕm oei tơ noh pơm bơnă; krao apinh Kră Yang bĕ; yua kơ lu iĕm đei hiôk jơnap noh đơ̆ng pơlei noh hiôk jơnap.”"
"For thus says the LORD of hosts, the God of Israel: Do not let your prophets and your diviners who are in your midst deceive you, nor listen to your dreams which you cause to be dreamed.","Kră Yang Tih Hloh, 'Bok Kei-Dei bơngai Isơrael khan: “'Nĕ pă lê̆ lu 'bok khan lê̆ adrol păng lu pơjâu oei hơdai iĕm chă hơlĕnh kơ iĕm; păng kư̆m 'nĕ pă hlŭ mơ̆ng kiơ̆ nơ̆r lu sư apo"
"For they prophesy falsely to you in My name; I have not sent them, says the LORD.","yua kơ lu sư khan lê̆ adrol hơlĕnh hăm anăn Inh. Inh ưh kơ đei wơh lu sư ôh.” Noh Kră Yang khan."
"For thus says the LORD: After seventy years are completed at Babylon, I will visit you and perform My good word toward you, and cause you to return to this place.","Kră Yang khan: “Layơ tôm tơpơh-jĭt sơnăm ăn kơ Babilôn pơgơ̆r, Inh gô năm hơpong tơ lu iĕm, Inh gô pơm trŏ thoi nơ̆r pơkă 'lơ̆ng rŏ Inh, gô chông ba lu iĕm brŏk tơ teh đak âu.”"
"For I know the thoughts that I think toward you, says the LORD, thoughts of peace and not of evil, to give you a future and a hope.","Kră Yang khan: “Yua kơ Inh băt tơdrong kiơ Inh pơkă wă pơm kơ lu iĕm. Inh đei pơkă ăn tơdrong hiôk-hian phĭ jơnap ưh kơ trŏ tơdrong kơnê̆ răm ôh, wă kơ lu iĕm đei tơdrong gơnang hơmĕng."
"Then you will call upon Me and go and pray to Me, and I will listen to you.","Kơplah lu iĕm năm krao chă Inh, krao apinh Inh, Inh gô tơl tơwih."
"And you will seek Me and find Me, when you search for Me with all your heart.","Lu iĕm gô chă Inh păng gơh tơ'bơ̆p tơdah lu iĕm chă Inh hăm đĭ jơhngơ̆m.”"
"I will be found by you, says the LORD, and I will bring you back from your captivity; I will gather you from all the nations and from all the places where I have driven you, says the LORD, and I will bring you to the place from which I cause you to be carried away captive.","Kră Yang khan: “Inh gô ăn kơ lu iĕm tơ'bơ̆p Inh păng Inh gô iŏk chông anhăk pơdrâu lu iĕm brŏk đơ̆ng pơm bơnă.” Kră Yang khan: “Inh gô akŭm pơđĭ lu iĕm đơ̆ng jơ̆p kơ dêh char, đơ̆ng rim pơlei pơla mă Inh đei puh lu iĕm tơ noh păng gô iŏk anhăk lu iĕm wih brŏk tơ teh đak mă đêl Inh puh iĕm đơ̆ng noh sơ̆.”"
"Because you have said, “The LORD has raised up prophets for us in Babylon”","Lu iĕm khan: “Kră Yang đei ăn boih kơ lu bơ̆n 'bok khan lê̆ adrol tơ char Babilôn!”"
"therefore thus says the LORD concerning the king who sits on the throne of David, concerning all the people who dwell in this city, and concerning your brethren who have not gone out with you into captivity","Kră Yang khan gah pơtao mă oei 'bơ̆t tang-dŏ pơtao Đawit păng lu kon pơlei mă oei lăm pơlei âu, lu bơngai mă huay kơ năm pơm bơnă hơdai lu iĕm"
"thus says the LORD of hosts: Behold, I will send on them the sword, the famine, and the pestilence, and will make them like rotten figs that cannot be eaten, they are so bad.","lei, na 'nâu nơ̆r Kră Yang Tih Hloh khan: “Inh gô ăn đao gưm, pơngot rơwĕt păng tơdrong lôch hơbuh truh tơ lu sư, pơm ăn kơ lu sư thoi plei hơra ôm kơnê̆ dĭng mah đe pă gơh sa."
"And I will pursue them with the sword, with famine, and with pestilence; and I will deliver them to trouble among all the kingdoms of the earth—to be a curse, an astonishment, a hissing, and a reproach among all the nations where I have driven them","Inh gô ăn đao gưm, pơngot rơwĕt păng jĭ hơbuh druh pơrăm lu sư, đe gô puh lê̆ lu sư tơ to tơ âu. Tơ jơ̆p-jang kơ dêh char lăm teh đak âu, lăng krưp, lu sư pŭ hơngiap đe blei hiap, đe che bơle, đe pơjăm pơjuă lu sư tơ rim adrĕch adrung mă Inh đei pơpuh lê̆ lu sư tơ noh.”"
"because they have not heeded My words, says the LORD, which I sent to them by My servants the prophets, rising up early and sending them; neither would you heed, says the LORD.","Kră Yang khan: “Noh yua kơ lu sư kuă kơ mơ̆ng nơ̆r Inh, Inh chơ̆n oei wơh lu bơngai khan lê̆ adrol, lu đĭch đam Inh năm tơbăt ăn kơ lu sư nơ̆r Inh; mă-lei lu iĕm kư̆m kuă kơ mơ̆ng lei-lăi."
"Therefore hear the word of the LORD, all you of the captivity, whom I have sent from Jerusalem to Babylon.","Thoi noh ơ đĭ-đăng lu bơngai bơnă mă Inh đei puh đơ̆ng pơlei Jêrusalem năm tơ char Babilôn, mơ̆ng bĕ nơ̆r Kră Yang.”"
"Thus says the LORD of hosts, the God of Israel, concerning Ahab the son of Kolaiah, and Zedekiah the son of Maaseiah, who prophesy a lie to you in My name: Behold, I will deliver them into the hand of Nebuchadnezzar king of Babylon, and he shall slay them before your eyes.","'Nâu Kră Yang Tih Hloh, 'Bok Kei-Dei bơngai Isơrael khan thoi âu gah Ahap, kon drŏ-nglo Kôlaia păng Sêđekia, kon drŏ-nglo Maaseia, bơngai mă yua anăn Inh khan lê̆ adrol hơlĕnh: “Inh gô jao lu sư kơ Nebukatnessar, pơtao Babilôn, sư gô pơlôch bre noh 'bơ̆t anăp lu iĕm."
"And because of them a curse shall be taken up by all the captivity of Judah who are in Babylon, saying, “The LORD make you like Zedekiah and Ahab, whom the king of Babylon roasted in the fire”","Đĭ-đăng bơngai Juđa pơm bơnă lăm char Babilôn gô iŏk yua anăn 'bar 'nu bơngai 'nâu hiap tơhuăi, thoi âu: “Apinh Kră Yang ăn kơ iĕm kư̆m thoi Sêđekia păng Ahap, mă pơtao Babilôn đei phang lăm ŭnh,’"
"because they have done disgraceful things in Israel, have committed adultery with their neighbors’ wives, and have spoken lying words in My name, which I have not commanded them. Indeed I know, and am a witness, says the LORD.","yua kơ lu sư đei pơm yoch bơlŭk kơnê̆ boih lăm lu bơngai Isơrael, pơm yoch ngôi pơyô kư̆ kă hăm akăn lu bơngai rông 'bôt sư kơdih păng pơma hơlĕnh mă Inh ưh kơ đei athei lu sư. Inh băt păng pơm kơdranh kơ tơdrong noh. Noh Kră Yang khan."
"You shall also speak to Shemaiah the Nehelamite, saying","Roi tơbăt bĕ kơ Sêmaia bơngai Nêhelam"
"Thus speaks the LORD of hosts, the God of Israel, saying: You have sent letters in your name to all the people who are at Jerusalem, to Zephaniah the son of Maaseiah the priest, and to all the priests, saying","“'Nâu Kră Yang Tih Hloh, 'Bok Kei-Dei bơngai Isơrael khan: ‘Ih đei gơih boih hla bơar kơ đĭ kon pơlei Jêrusalem, kơ 'bok soi Sephania kon drŏ-nglo Maaseia păng kơ đĭ-đăng lu 'bok soi nai khan"
"“The LORD has made you priest instead of Jehoiada the priest, so that there should be officers in the house of the LORD over every man who is demented and considers himself a prophet, that you should put him in prison and in the stocks.","Kră Yang đei jao ăn kơ ih boih pơm 'bok soi tơplih kơ Jêhôiada wă pơgơ̆r wei-lăng hnam akŭm Kră Yang Ih gơh athei đe rôp hơnuh ako, rôp jơlŏng lê̆ jơ̆ng, tơdah bu mă wơnh khan lê̆ adrol"
"Now therefore, why have you not rebuked Jeremiah of Anathoth who makes himself a prophet to you?","Lei liơ ih ưh kơ rôp chrih kơ Jêrêmi pơlei Anathôt, sư oei khan lê̆ adrol, tơ lăm lu iĕm?"
"For he has sent to us in Babylon, saying, ‘This captivity is long; build houses and dwell in them, and plant gardens and eat their fruit.’ ”","Sư boih, pơ̆n gơih kơ lu nhôn nơ̆r tơ lăm char Babilôn khan: Tơdrong pơm bơnă oei đunh năr; pơm bĕ hnam oei; pơtăm bĕ 'long sa plei lăm mir pơgar na sa plei sư.”"
"Now Zephaniah the priest read this letter in the hearing of Jeremiah the prophet.","Sephania 'bok soi đŏk kơthơ noh tơm măt Jêrêmi bơngai khăn lê̆ adrol mơ̆ng."
"Then the word of the LORD came to Jeremiah, saying","Nơ̆r Kră Yang khan kơ Jêrêmi"
"Send to all those in captivity, saying, Thus says the LORD concerning Shemaiah the Nehelamite: Because Shemaiah has prophesied to you, and I have not sent him, and he has caused you to trust in a lie","“Chih roi bĕ kơ đĭ-đăng kon pơlei oei pơm bơnă: 'Nâu Kră Yang khan gah Sêmaia bơngai Nêhelam: ‘Yua kơ Sêmaia khan lê̆ adrol kơ lu iĕm boih, mă Inh ưh kơ athei sư khan păng sư kư̆m pơm kơ iĕm lui kơ nơ̆r sư hơlĕnh.’"
"therefore thus says the LORD: Behold, I will punish Shemaiah the Nehelamite and his family: he shall not have anyone to dwell among this people, nor shall he see the good that I will do for My people, says the LORD, because he has taught rebellion against the LORD.","Na Kră Yang khan: “Inh gô phak Sêmaia, bơngai Nêhelam păng adrĕch adrung sư hai dơ̆ng. Gah adrĕch sư, ưh kơ đei bu mă oei arih hơdai hăm kon pơlei 'nâu; kơdih akâu sư kư̆m ưh kơ đei 'bôh tơdrong hiôk mă Inh gô ăn kơ kon pơlei Inh, yua kơ sư pơma blơ̆ plơ̆ Inh.’ ” Noh Kră Yang khan."
"The word that came to Jeremiah from the LORD, saying","'Nâu nơ̆r Kră Yang khan kơ Jêrêmi"
"“Thus speaks the LORD God of Israel, saying: ‘Write in a book for yourself all the words that I have spoken to you.","'Nâu Kră Yang, 'Bok Kei-Dei bơngai Isơrael khan: “Chih răk bĕ lăm sơnôm hla bơar nơ̆r Inh đei bơtho khan kơ ih boih.”"
"For behold, the days are coming,’ says the LORD, ‘that I will bring back from captivity My people Israel and Judah,’ says the LORD. ‘And I will cause them to return to the land that I gave to their fathers, and they shall possess it.’ ”","Kră Yang khan: “Gô đei năr, Inh gô chông ba kon pơlei Inh bơngai Juđa păng Isơrael wih brŏk đơ̆ng pơm bơnă. Kră Yang khan: “Inh gô ba lu sư brŏk iŏk teh đak mă Inh đei ăn boih kơ lu yă 'bok lu sư.”"
"Now these are the words that the LORD spoke concerning Israel and Judah.","'Nâu nơ̆r Kră Yang đei khan gah bơngai Isơrael păng Juđa."
"“For thus says the LORD: ‘We have heard a voice of trembling, Of fear, and not of peace.","'Nâu Kră Yang khan: “Inh đei kơtơ̆ng boih nơ̆r ôr krao hli tơrơ, ưh kơ đei hiôk-hian."
"Ask now, and see, Whether a man is ever in labor with child? So why do I see every man with his hands on his loins Like a woman in labor, And all faces turned pale?","Jet lăng: Hăm trŏ kơ bơngai drŏ-nglo tơpŭ kon hơ'lơ̆p? Lei liơ mă Inh 'bôh bơngai drŏ-nglo kơ'mĭn klak thoi drŏ-kăn wă tơpŭ? Liơ mă muh măt lu sư dreng hơ'blă?"
"Alas! For that day is great, So that none is like it; And it is the time of Jacob’s trouble, But he shall be saved out of it.","Ô! Năr noh kơnê̆ krưp tih tơpă, mă ning-mônh kư̆m ưh kơ đei năr kơnê̆ dêh thoi noh. Noh boih năr truh răm kơ Jakôp! Mă-lei Inh gô dŏng lu sư klaih đơ̆ng noh.”"
"‘For it shall come to pass in that day,’ Says the LORD of hosts, ‘That I will break his yoke from your neck, And will burst your bonds; Foreigners shall no more enslave them.","Kră Yang Tih Hloh khan: “Lăm năr noh Inh gô gơ̆ lê̆ 'long ăt đơ̆ng ako lu sư; păng hrĕch lê̆ tơlei đêl đe chô̆ lu sư, ưh pă pơm đĭch kơ dêh tơmoi dơ̆ng"
"But they shall serve the LORD their God, And David their king, Whom I will raise up for them.","Mă-lei lu sư gô chu yom kơ Kră Yang 'Bok Kei-Dei lu sư, păng Đawit pơtao lu sư, Inh gô atŏk ăn.”"
"‘Therefore do not fear, O My servant Jacob,’ says the LORD, ‘Nor be dismayed, O Israel; For behold, I will save you from afar, And your seed from the land of their captivity. Jacob shall return, have rest and be quiet, And no one shall make him afraid.","Kră Yang khan: “Ơ Jakôp, ih boih đĭch đam Inh, 'nĕ kơ hli. Ơ Isơrael, 'nĕ pă tơrơ! Inh gô dŏng pơklaih iĕm đơ̆ng dêh ataih, đơ̆ng teh đak iĕm pơm bơnă. Jakôp gô brŏk hiôk-hian, rơnŭk rơnua jang sa, ưh kơ đei hli tơrơ kơ bu dơ̆ng.”"
"For I am with you,’ says the LORD, ‘to save you; Though I make a full end of all nations where I have scattered you, Yet I will not make a complete end of you. But I will correct you in justice, And will not let you go altogether unpunished.’","Kră Yang khan: “Inh oei păng iĕm, wă dŏng pơklaih iĕm. Inh gô pơlôch pơrăm đĭ lu dêh char, mă Inh đei puh iĕm tơklah tơklang lăm noh, mă-lei Inh huay kơ pơlôch iĕm. Inh gô phak bơtho lu iĕm kiơ̆ kơ tơdrong trŏ, Inh ưh kơ lê̆ ôh phak bơtho lu iĕm.”"
"“For thus says the LORD: ‘Your affliction is incurable, Your wound is severe.","Kră Yang khan: “Tơdrong jĭ rơka iĕm ưh pă gơh klaih boih; rơka jĭ iĕm jrŭ dêh."
"There is no one to plead your cause, That you may be bound up; You have no healing medicines.","Ưh kơ đei bu tơgŭm iĕm, ưh kơ đei pơgang kiơ wă kơ iĕm huay kơ jĭ, rơka jĭ iĕm ưh pă tơsir boih."
