English, Bahnar
"Righteous are You, O LORD, when I plead with You; Yet let me talk with You about Your judgments. Why does the way of the wicked prosper? Why are those happy who deal so treacherously?","Ơ Kră Yang, Ih jơ̆ 'lơ̆ng tơpăt mưh inh roi tơdrong inh kơ Ih. Mă-lei inh oei wă pơma hăm Ih trŏ tơdrong tơpăt Ih: Liơ trong lu bơngai kơnê̆ oei hiôk-hian, liơ tơdrong jang lu bơngai hơlĕnh pơdăr oei mơdrŏng?"
"You have planted them, yes, they have taken root; They grow, yes, they bear fruit. You are near in their mouth But far from their mind.","Ih pơtăm lu sư, lu sư chăt rơh, wơ̆ tih păng đei plei, 'bơ̆r lu sư jê̆ Ih, mă-lei jơhngơ̆m lu sư ataih đơ̆ng Ih."
"But You, O LORD, know me; You have seen me, And You have tested my heart toward You. Pull them out like sheep for the slaughter, And prepare them for the day of slaughter.","Mă-lei, ơ Kră Yang, Ih băt boih kơ inh, Ih 'bôh inh, Ih pơlong lăng păng băt jơhngơ̆m inh hăm Ih, Apinh Ih dui lu sư tơ 'nguaih thoi đe dui triu wă 'bet pơlôch, Apinh Ih lê̆ lu sư pha 'măn kơ năr wă 'bet pơlôch!"
"How long will the land mourn, And the herbs of every field wither? The beasts and birds are consumed, For the wickedness of those who dwell there, Because they said, “He will not see our final end.”","Lăm char gô ơh sơ'ngon dĭng dang yơ? 'Nhĕt tơ chŭn mir gô jô kro dĭng dang yơ? Yua kơ đơ̆ng tơdrong kơnê̆ kon pơlei oei lăm noh pơm, lu sem bri sem păr lôch đĭ. Đei lu sư khan: “Kră Yang ưh kơ 'bôh ôh tơdrong kiơ lu bơ̆n pơm.”"
"“If you have run with the footmen, and they have wearied you, Then how can you contend with horses? And if in the land of peace, In which you trusted, they wearied you, Then how will you do in the floodplain of the Jordan?","Tơdah ih kơdâu pơlong jơ̆ng hoh hăm đe boih, na jei đe, Liơ ih kĕ kơdâu pơlong hăm aseh lĕ? Kơplah lăm char oei hiôk-hian mă ih pơ̆k boih, liơ ih kĕ tŏk lăm bri brah đak Krong Jôrđăn?"
"For even your brothers, the house of your father, Even they have dealt treacherously with you; Yes, they have called a multitude after you. Do not believe them, Even though they speak smooth words to you.","Lu 'nhŏng oh ih adrĕch adrung 'bă ih, mă lu sư kư̆m jreo tơkĕch wă pơm kơ ih. 'Nĕ kơ gơnang kơ lu sư, mă khan lu sư pơma hiôk hăm ih ră."
"“I have forsaken My house, I have left My heritage; I have given the dearly beloved of My soul into the hand of her enemies.","Inh achăng boih hnam Inh, Inh lê̆ boih kon pơlei Inh; Inh jao boih kon pơlei mă Inh 'mêm lăm ti lu bơngai ayăt kơ lu sư."
"My heritage is to Me like a lion in the forest; It cries out against Me; Therefore I have hated it.","Kon pơlei Inh pơm kơ Inh, thoi dăm-brang lăm bri. Sư hơrum wă pơm kơ Inh, thoi noh Inh areh achăng lê̆ lu sư."
"My heritage is to Me like a speckled vulture; The vultures all around are against her. Come, assemble all the beasts of the field, Bring them to devour!","Kon pơlei Inh hăm trŏ thoi klang, Lu klang nai wang tăp dăr wă pơm kơ kon pơlei Inh hă? Akŭm bĕ đĭ-đăng lu sem bri, ba lu sư sa kon pơlei Inh."
"“Many rulers have destroyed My vineyard, They have trodden My portion underfoot; They have made My pleasant portion a desolate wilderness.","Lu bơngai wei triu pơrăm boih mir hơmu Inh; Pơjuă gơhlơ̆r teh Inh jang sa; lu sư pơm kơ teh 'lơ̆ng Inh jing bri juơ."
"They have made it desolate; Desolate, it mourns to Me; The whole land is made desolate, Because no one takes it to heart.","Đe pơm kơ anih noh jing juơ rơhiăng; đe pơrăm boih sư ôr 'bơ̆t anăp Inh. Jơ̆p kơ dêh char noh jing juơ, ưh kơ đei bu wă lăng."
"The plunderers have come On all the desolate heights in the wilderness, For the sword of the LORD shall devour From one end of the land to the other end of the land; No flesh shall have peace.","Lu bơngai wă pơrăm truh boih, tơ jơ̆p-jang kơ groi grôn kơjung tơ lăm tơmăn glă; yua kơ đao gưm Kră Yang oei pơrăm teh đơ̆ng teh âu dĭng tơ to; Ưh kơ đei kon bơngai dah Sem brem kiơ mă oei hiôk hơđơ̆ng."
"They have sown wheat but reaped thorns; They have put themselves to pain but do not profit. But be ashamed of your harvest Because of the fierce anger of the LORD.”","Lu sư rei boih 'ba mi mă-lei kĕch iŏk găr jơla; lu sư jang hrat mă-lei ưh kơ yua kiơ. Gô mơlâu kơ kĕch iŏk tŏ sĕt, Yua kơ Kră Yang hil kơtang tơpă."
"Thus says the LORD: “Against all My evil neighbors who touch the inheritance which I have caused My people Israel to inherit—behold, I will pluck them out of their land and pluck out the house of Judah from among them.","'Nâu Kră Yang khan: “Gah đĭ-đăng lu rông 'bôt Inh mă pơm kơnê̆, mơ̆t iŏk boih tơmam Inh mă ăn kơ lu kon pơlei Inh, Isơrael; 'nâu, Inh gô buch hiŏng lê̆ lu sư đơ̆ng lăm char lu sư păng buch hiŏng lê̆ adrĕch Juđa đơ̆ng tŏk-bŏk lu sư."
"Then it shall be, after I have plucked them out, that I will return and have compassion on them and bring them back, everyone to his heritage and everyone to his land.","Mă-lei đơ̆ng rŏng kơ Inh buch lê̆ lu sư boih, Inh gô mơnat kơ lu sư dơ̆ng. Inh gô anhăk ba lu sư wih tơ char lu sư kơdih păng iŏk teh jang sa."
"And it shall be, if they will learn carefully the ways of My people, to swear by My name, ‘As the LORD lives,’ as they taught My people to swear by Baal, then they shall be established in the midst of My people.","Tơdah lu sư pơnam hŏk pơhrăm iŏk kiơ̆ trong kon pơlei pơla Inh păng pơkă pơkăm hăm anăn Inh. ‘Tơpă Kră Yang arih,’ thoi sơ̆ lu sư kư̆m bơtho kon pơlei Inh pơkă hăm yang Baal, kơplah noh lu sư gô oei kơjăp lăm kon pơlei pơla Inh."
"But if they do not obey, I will utterly pluck up and destroy that nation,” says the LORD.","Mă-lei tơdah lu kon pơlei ayơ kuă kơ mơ̆ng nơ̆r Inh, Inh gô buch hŭt lê̆ hloi kon pơlei noh, buch pơlôch lê̆ hloi” 'noh Kră Yang khan."
"Thus the LORD said to me: “Go and get yourself a linen sash, and put it around your waist, but do not put it in water.”","Kră Yang khan kơ inh thoi âu: “Năm răt bĕ che hơtăng tơ̆n kơiĕng ih, na tơ̆n 'bơ̆t kơiĕng ih mă-lei 'nĕ kơ tong lăm đak.”"
"So I got a sash according to the word of the LORD, and put it around my waist.","Inh răt che tơ̆n kơiĕng kiơ̆ thoi Kră Yang athei, na inh tơ̆n sư tơ kơiĕng inh."
"And the word of the LORD came to me the second time, saying","Kră Yang khan kơ inh wơ̆t mă 'bar dơ̆ng"
"“Take the sash that you acquired, which is around your waist, and arise, go to the Euphrates, and hide it there in a hole in the rock.”","“Chĕp ba bĕ che tơ̆n kơiĕng mă ih răt, dang ei oei tơ̆n noh, iung năm bĕ tơ jê̆ đak Krong Ơphrat, na tah ôn bĕ che noh lăm tơmo hơđang.”"
"So I went and hid it by the Euphrates, as the LORD commanded me.","Thoi noh na inh năm ôn lê̆ che noh tơ jê̆ đak Krong Ơphrat kiơ̆ thoi nơ̆r Kră Yang athei inh."
"Now it came to pass after many days that the LORD said to me, “Arise, go to the Euphrates, and take from there the sash which I commanded you to hide there.”","Đunh năr 'biơ̆ đơ̆ng rŏng kơ noh, Kră Yang khan kơ inh: “Iung bĕ năm tơ đak Krong Ơphrat na iŏk dơ̆ng che tơ̆n kơiĕng mă Inh đei athei ih ôn tơ noh ki."
"Then I went to the Euphrates and dug, and I took the sash from the place where I had hidden it; and there was the sash, ruined. It was profitable for nothing.","Na inh năm tơ đak Krong Ơphrat, sir dui iŏk che tơ̆n kơiĕng đơ̆ng anih mă inh ôn lê̆, lăng âu che tơ̆n kơiĕng noh bluch boih, ưh pă gơh yua dơ̆ng."
"Then the word of the LORD came to me, saying","Kră Yang khan kơ inh"
"“Thus says the LORD: ‘In this manner I will ruin the pride of Judah and the great pride of Jerusalem.","Kră Yang khan thoi âu: “Inh gô pơrăm tơdrong pơang lu bơngai Juđa păng tơdrong pơang pơlei tih Jêrusalem."
"This evil people, who refuse to hear My words, who follow the dictates of their hearts, and walk after other gods to serve them and worship them, shall be just like this sash which is profitable for nothing.","Kon pơlei kơnê̆ âu sơngah boih kuă kơ mơ̆ng nơ̆r Inh athei, arih pơm kiơ̆ kơ jơhngơ̆m arăng lu sư kơdih wă, kơkuh awih awăn kơ yang nai; na lu sư jing thoi che tơ̆n kơiĕng âu, ưh pă gơh wă yua pơm kiơ dơ̆ng."
"For as the sash clings to the waist of a man, so I have caused the whole house of Israel and the whole house of Judah to cling to Me,’ says the LORD, ‘that they may become My people, for renown, for praise, and for glory; but they would not hear.’","Pơtih thoi che tơ̆n kơiĕng klep tơ kơiĕng rim 'nu bơngai thoi yơ, Inh gô ăn kơ đĭ-đăng adrĕch adrung bơngai Isơrael, hăm adrĕch Juđa klep tơ Inh thoi noh, wă kơ lu sư jing kon pơlei pơla Inh, wă ư-ang, kơ Inh wă kơkuh bơnê kơ Inh. Mă-lei lu sư kuă kơ mơ̆ng Inh.”"
"“Therefore you shall speak to them this word: ‘Thus says the LORD God of Israel: “Every bottle shall be filled with wine.” ’ And they will say to you, ‘Do we not certainly know that every bottle will be filled with wine?’","Roi ăn bĕ kơ lu sư tơdrong 'nâu: “Kră Yang, 'Bok Kei-Dei Isơrael khan: ‘Rim kơdŭng akar sik athei tuh 'bĕnh sik hơmu.’ Tơdah lu sư khan kơ ih: ‘Rŏ kơ nhôn ưh kơ băt rim kơdŭng akar sik athei 'bĕnh kơ đak sik hơmu.”"
"“Then you shall say to them, ‘Thus says the LORD: “Behold, I will fill all the inhabitants of this land—even the kings who sit on David’s throne, the priests, the prophets, and all the inhabitants of Jerusalem—with drunkenness!","Ih athei khan kơ lu sư. Kră Yang khan: “'Nâu, Inh gô tuh sik 'bĕnh kơ 'bơ̆r kon pơlei oei lăm dêh char âu, lu pơtao mă hơ-oei 'bơ̆t tang-dŏ pơtao Đawit, lu 'bok soi, lu 'bok khan lê̆ adrol păng kơ đĭ-đăng lu bơngai mă oei lăm pơlei Jêrusalem."
"And I will dash them one against another, even the fathers and the sons together,” says the LORD. “I will not pity nor spare nor have mercy, but will destroy them.” ’ ”","Inh gô hơtŭt lu sư, lu sư pơchah hơtŭt băl kon drŏ-nglo hăm 'bă sư, Inh ưh pă pơdơh ti, pă mơnat, ưh pă 'mêm kơ lu sư, kơplah Inh pơrăm lu sư.”"
"Hear and give ear: Do not be proud, For the LORD has spoken.","Pơgling đon iĕm mơ̆ng bĕ. 'Nĕ kơ pơang, Yua kơ Kră Yang khan boih."
"Give glory to the LORD your God Before He causes darkness, And before your feet stumble On the dark mountains, And while you are looking for light, He turns it into the shadow of death And makes it dense darkness.","Ư-ang bĕ kơ Kră Yang 'Bok Kei-Dei iĕm, adrol kơ Sư wă ăn măng mu truh, adrol kơ jơ̆ng lu iĕm kơtơih 'bơm kông măng mu gueo. Kơplah lu iĕm chă hơdah ră, Sư tơplih tă tơ măng mu, Sư gô ăn kơ măng mu jing măng klăm hơ'bơ̆l gueo."
"But if you will not hear it, My soul will weep in secret for your pride; My eyes will weep bitterly And run down with tears, Because the LORD’s flock has been taken captive.","Mă-lei tơdah lu iĕm kuă kơ mơ̆ng, inh gô nhơ̆m lăm to, yua kơ tơdrong lu iĕm pơang. Măt inh gô nhơ̆m ơh ol dêh, đak măt inh gô lĕch ro, yua kơ triu Kră Yang đe gô rôp pơm bơnă."
"Say to the king and to the queen mother, “Humble yourselves; Sit down, For your rule shall collapse, the crown of your glory.”","Khan bĕ kơ pơtao păng mĕ pơtao: “Jur bĕ đơ̆ng tang-dŏ pơtao hơ-oei tơ teh, yua kơ môk pơtao ư-ang huŏng đơ̆ng kơ̆l boih."
"The cities of the South shall be shut up, And no one shall open them; Judah shall be carried away captive, all of it; It shall be wholly carried away captive.","Đĭ-đăng pơlei lăm tơring Negewơ đe gô wang tăp, ưh kơ đei bu pơih gơh lĕch. Đĭ-đăng adrĕch Juđa đe gô rôp pơđĭ ưh pă đei bu klaih."
"Lift up your eyes and see Those who come from the north. Where is the flock that was given to you, Your beautiful sheep?","Ngơk lăng bĕ; lu bơngai mă truh đơ̆ng gah yă-nơ̆m to. Khŭl triu mă Inh ăn boih kơ ih, đĭ-đăng khŭl triu mă ih pơư tơ yơ boih."
"What will you say when He punishes you? For you have taught them To be chieftains, to be head over you. Will not pangs seize you, Like a woman in labor?","Ih gô pơma liơ mưh Kră Yang ăn minh 'nu bơngai tơmoi pơm yŏng pơgơ̆r ih. Lu bơngai mă buăl juăt iĕm, lu bơngai mă lu iĕm đei bơtho pơhrăm lê̆ sơ̆? Ih ưh kơ jĭ jơhngơ̆m klơm klak thoi bơngai drŏ-kăn hơiơch?"
"And if you say in your heart, “Why have these things come upon me?” For the greatness of your iniquity Your skirts have been uncovered, Your heels made bare.","Păng tơdah ih khan lăm jơhngơ̆m ih. “Yua kơ kiơ tơdrong 'nâu truh kơ inh?” Noh yua kơ tơdrong yoch kơnê̆ ih tih tơpă. Dĭng mah đe tưk hơbĕn ih, păng đe gô tơrôp pơm kơnê̆ kơ ih."
"Can the Ethiopian change his skin or the leopard its spots? Then may you also do good who are accustomed to do evil.","Bơngai Êthiôpi hăm gơh tơplih ming akar găm lu sư, djrang hăm gơh tơplih sŏk brông lu sư, lu iĕm kư̆m lei-lăi juăt kơ pơm yoch boih. Liơ iĕm gơh pơm 'lơ̆ng?"
"“Therefore I will scatter them like stubble That passes away by the wind of the wilderness.","“Inh gô pơpuh pơđông lu iĕm thoi kial bah đơ̆ng char glă pơđông hơkam 'ba."
"This is your lot, The portion of your measures from Me,” says the LORD, “Because you have forgotten Me And trusted in falsehood.","'Nâu boih tơdrong Inh 'măn lê̆ kơ iĕm, đei klah asong hơgăt lê̆ pha ăn kơ ih.” Noh Kră Yang khan: Yua kơ iĕm hiơt kơ Inh boih; na gơnang kơ rup yang hơlĕnh pơdăr."
"Therefore I will uncover your skirts over your face, That your shame may appear.","Inh gô plôh lê̆ hơbĕn iĕm truh tơ muh măt iĕm, na gô 'bôh tơdrong mơlâu iĕm."
"I have seen your adulteries And your lustful neighings, The lewdness of your harlotry, Your abominations on the hills in the fields. Woe to you, O Jerusalem! Will you still not be made clean?”","Inh 'bôh boih tơdrong kơnê̆ iĕm pơm, Ih pơm pơyô kư̆ kă, tơdrong luĕl 'blal. Pơm pơyô kư̆ kă tơ lăm groi dah tơ mir chŭn. Ơ Jêrusalem răm-'băm tơpă kơ iĕm! Iĕm ưh kơ wă hơmet rơgoh dĭng dang yơ?”"
"The word of the LORD that came to Jeremiah concerning the droughts.","'Nâu nơ̆r Kră Yang khan kơ Jêrêmi kơ tơdrong wă đei phang-ang."
"“Judah mourns, And her gates languish; They mourn for the land, And the cry of Jerusalem has gone up.","“Char Juđa ơh sơ'ngon, lu pơlei tih sư kư̆m ơh ăk, kon pơlei nhơ̆m hmoi drap tơ teh, Kơtơ̆ng nơ̆r ôr krao đơ̆ng pơlei Jêrusalem."
"Their nobles have sent their lads for water; They went to the cisterns and found no water. They returned with their vessels empty; They were ashamed and confounded And covered their heads.","Lu yŏng tơ'ngla wơh lu đĭch đam sư năm chă đak, lu sư năm tơ sơlŭng đak mă-lei ưh kơ đei 'bôh đak, lu sư wih brŏk ge hoh; lu yŏng tơ'ngla mơlâu hlơ̆l, gom lê̆ kơ̆l lu sư."
"Because the ground is parched, For there was no rain in the land, The plowmen were ashamed; They covered their heads.","Teh kro hơđang đĭ, yua kơ ưh pă đei 'mi jur boih tơ teh, lu bơngai jang mir 'ba ơh sơ'ngon na gom kơ̆l lu sư."
"Yes, the deer also gave birth in the field, But left because there was no grass.","Juei akăn 'nao tuh kon, kư̆m achăng lê̆ kon sư, yua kơ ưh kơ đei 'nhĕt wă sa."
"And the wild donkeys stood in the desolate heights; They sniffed at the wind like jackals; Their eyes failed because there was no grass.”","Lu aseh bri oei dơ̆ng kơpal groi dui jơhngơ̆m mơhik thoi kŏ bri, măt lu sư hơlơp yua kơ ưh kơ đei 'nhĕt sa.”"
"O LORD, though our iniquities testify against us, Do it for Your name’s sake; For our backslidings are many, We have sinned against You.","Ơ Kră Yang mă khan tơdrong kơnê̆ lu nhôn plơ̆ tơbăt kơ lu nhôn, apinh Ih tơgŭm nhôn yua kơ anăn Ih! Tơpă lu nhôn pơm kơnê̆ tih dêh; lu nhôn pơm yoch hăm Ih boih."
"O the Hope of Israel, his Savior in time of trouble, Why should You be like a stranger in the land, And like a traveler who turns aside to tarry for a night?","Ơ Kră Yang Ih boih tơ'ngla mă lu bơngai Isơrael chang hơmĕng. Tơ'ngla mă dŏng pơklaih kơplah năr đei tơdrong truh, liơ Ih nhen thoi bơngai tơmoi lăm char âu, Thoi bơngai chă yak găn weh 'bĭch kơmăng đĕch."
"Why should You be like a man astonished, Like a mighty one who cannot save? Yet You, O LORD, are in our midst, And we are called by Your name; Do not leave us!","Liơ Ih nhen thoi bơngai đei tơdrong truh ưh kơ tam băt, nhen thoi bơngai nuih pran mă ưh kơ gơh dŏng pơklaih bu? Mă-lei ơ Kră Yang, Ih oei oei hơdai nhôn, đe krao nhôn kon Ih, apinh Ih 'nĕ kơ achăng lê̆ lu nhôn."
"Thus says the LORD to this people: “Thus they have loved to wander; They have not restrained their feet. Therefore the LORD does not accept them; He will remember their iniquity now, And punish their sins.”","Kră Yang khan gah kon pơlei 'nâu: “Lu sư 'maih kơdâu tơklah thoi noh, ưh kơ băt pơkơ̆ng jơ̆ng lu sư; Na Kră Yang ưh kơ sơng iŏk lu sư; Dang ei, Kră Yang 'blŏk kơ tơdrong kơnê̆ lu sư, Kră Yang wă phak lu sư đơ̆ng pơm yoch.”"
"Then the LORD said to me, “Do not pray for this people, for their good.","Kră Yang khan kơ inh: “Ih 'nĕ krao khan apinh Kră Yang ăn tơdrong hiôk 'lơ̆ng kơ kon pơlei âu"
"When they fast, I will not hear their cry; and when they offer burnt offering and grain offering, I will not accept them. But I will consume them by the sword, by the famine, and by the pestilence.”","Mă khan lu sư ơ̆t kơ sŏng sa, Inh ưh kơ đei mơ̆ng nơ̆r lu sư krao khan ôh, mă khan lu sư pơyơ̆r tơmam soi 'buh dah tơmam soi phe 'ba, Inh ưh kơ iŏk ôh; mă-lei Inh gô pơrăm lu sư hăm đao gưm, hăm tơdrong pơngot rơwĕt păng hăm tơdrong jĭ hơpoh.”"
"Then I said, “Ah, Lord GOD! Behold, the prophets say to them, ‘You shall not see the sword, nor shall you have famine, but I will give you assured peace in this place.’ ”","Inh khan: “Ơ Kră Yang Tih Hloh, lu bơngai khan lê̆ adrol ling-lang khan kơ lu sư, ‘Lu iĕm ưh kơ đei 'bôh đao gưm, kư̆m huay kơ đei pơngot rơwĕt truh mơ̆n, Inh gô ăn kơ lu iĕm đei rơnŭk rơnua ling-lang lăm dêh char âu.’ ”"
"And the LORD said to me, “The prophets prophesy lies in My name. I have not sent them, commanded them, nor spoken to them; they prophesy to you a false vision, divination, a worthless thing, and the deceit of their heart.","Kră Yang khan kơ inh: “Lu bơngai khan lê̆ adrol yua anăn Inh na pơma hơlĕnh, Inh ưh kơ đei wơh lu sư ôh, kư̆m ưh kơ đei tơtă dah pơma athei lu sư mơ̆n. Lu sư khan lê̆ adrol kiơ̆ thoi lu sư chă pơm 'bôh ưh kơ tơpă, chă hlang pơpơn kư̆ kă wă pơhlŭ lu iĕm kiơ̆ kơ lu sư tơchĕng đon kơdih.”"
"Therefore thus says the LORD concerning the prophets who prophesy in My name, whom I did not send, and who say, ‘Sword and famine shall not be in this land’—‘By sword and famine those prophets shall be consumed!","Thoi noh Kră Yang khan: “Gah lu bơngai mă khan lê̆ adrol hơlĕnh, lu sư yua anăn Inh na khan lê̆ adrol Inh ưh kơ đei wơh, mă-lei lu sư khan. ‘Đao gưm hăm pơngot rơwĕt ưh kơ truh tơ dêh char âu ôh.’ Lu bơngai khan lê̆ adrol noh boih gô lôch kơ đao gưm păng pơngot rơwĕt."
"And the people to whom they prophesy shall be cast out in the streets of Jerusalem because of the famine and the sword; they will have no one to bury them—them nor their wives, their sons nor their daughters—for I will pour their wickedness on them.’","Lu kon pơlei mă mơ̆ng lu sư khan lê̆ adrol noh kư̆m lôch kơ đao gưm, pơngot rơwĕt hơdai hăm akăn, hăm kon drŏ-nglo kon drŏ-kăn lu sư. Akâu lu sư đe gô klơ̆m lê̆ hnơ̆k hnăk tơ rok trong pơlei Jêrusalem, ưh kơ đei bu 'bŭ. Inh gô tuh tơdrong kơnê̆ đêl lu sư pơm tơ kơ̆l lu sư.”"
"“Therefore you shall say this word to them: ‘Let my eyes flow with tears night and day, And let them not cease; For the virgin daughter of my people Has been broken with a mighty stroke, with a very severe blow.","Apinh ih khan kơ lu sư nơ̆r 'nâu: Ăn kơ măt inh lĕch đak măt ling-lang, Măng năr ưh kơ pơdơh, yua kơ kon adruh inh, kơ kon pơlei inh, răm-'băm jĭ rơka hơbur dêh, đe pơm jĭ pơmat dêh kơ lu sư."
"If I go out to the field, Then behold, those slain with the sword! And if I enter the city, Then behold, those sick from famine! Yes, both prophet and priest go about in a land they do not know.’ ”","Tơdah inh năm tơ mir chŭn, to akâu lu bơngai lôch kơ đao gưm, tơdah inh mơ̆t tơ pơlei tih, to 'bôh lu bơngai jĭ jăn yua kơ pơngot rơwĕt! Lu 'bok khan lê̆ adrol păng lu 'bok soi. Chă yak năm lăm dêh char mă lu sư ưh kơ lah băt."
"Have You utterly rejected Judah? Has Your soul loathed Zion? Why have You stricken us so that there is no healing for us? We looked for peace, but there was no good; And for the time of healing, and there was trouble.","Lei Ih wă achăng lê̆ lu bơngai Juđa hă? Ih kư̆m areh kơ Siôn hă? Liơ ih teh tôn lu nhôn, dĭng mah rơka lu nhôn hơmet pă klaih? Lu nhôn hơmĕng rŏ kơ hiôk-hian, Mă-lei ưh kơ đei tơdrong 'lơ̆ng; lu nhôn wă kơ gơh klaih, mă-lei rai tơ'bơ̆p tơdrong hli krưp."
"We acknowledge, O LORD, our wickedness And the iniquity of our fathers, For we have sinned against You.","Ơ Kră Yang lu nhôn băt nhôn yoch kơnê̆, păng tơdrong yoch lu yă 'bok lu nhôn pơm; tơpă lu nhôn đei pơm yoch kơnê̆ boih hăm Ih."
"Do not abhor us, for Your name’s sake; Do not disgrace the throne of Your glory. Remember, do not break Your covenant with us.","'Nĕ kơ achăng lê̆ lu nhôn; yua kơ anăn Ih, 'nĕ pơm kơ anih pơtao ư-ang Ih đe pơjăm, Apinh Ih 'blŏk bĕ nơ̆r Ih đei pơgơ̆p hăm lu nhôn păng 'nĕ kơ tŭk."
"Are there any among the idols of the nations that can cause rain? Or can the heavens give showers? Are You not He, O LORD our God? Therefore we will wait for You, Since You have made all these.","Hăm đei lu yang kiơ gơh pơm đak 'mi ăn kơ kon bơngai? Đơ̆ng plĕnh hăm gơh tơjur kơdih đak 'mi tơ teh? Ơ Kră Yang 'Bok Kei-Dei lu nhôn, Ih đĕch gơh pơm. Thoi noh lu nhôn oei chang gô Ih, Yua kơ Ih boih pơjing kơ dôm tơdrong noh."
"Then the LORD said to me, “Even if Moses and Samuel stood before Me, My mind would not be favorable toward this people. Cast them out of My sight, and let them go forth.","Kră Yang khan kơ inh: “Mă khan Môis păng Samuel dơ̆ng 'bơ̆t anăp Inh, Inh kư̆m ưh kơ mơnat kơ kon pơlei 'nâu. Pơpuh tơweh bĕ lu sư đơ̆ng anăp Inh."
"And it shall be, if they say to you, ‘Where should we go?’ then you shall tell them, ‘Thus says the LORD: “Such as are for death, to death; And such as are for the sword, to the sword; And such as are for the famine, to the famine; And such as are for the captivity, to the captivity.” ’","Tơdah lu sư apinh ih: ‘Lu nhôn gô năm tơ yơ?’ Ih khan kơ lu sư: 'Nâu Kră Yang khan: “Bu Inh pơkă ăn kơ sư lôch kơ hơbuh, gô chu lôch kơ hơbuh, Bu Inh pơkă wă pơlôch hăm đao gưm, gô lôch kơ đao gưm. Bu Inh pơkă wă ăn kơ sư lôch pơngot rơwĕt, gô lôch kơ pơngot rơwĕt. Bu Inh pơkă wă ăn pơm bơnă, sư gô pơm bơnă.”"
"“And I will appoint over them four forms of destruction,” says the LORD: “the sword to slay, the dogs to drag, the birds of the heavens and the beasts of the earth to devour and destroy.","Kră Yang khan: “Inh wă phak đei puăn tơdrong: Wă pơlôch păng đao gưm, kŏ gô hek sa, sem grơ̆ păng lu sem bri gô kăp sa păng pơrăm đĭ lu sư."
"I will hand them over to trouble, to all kingdoms of the earth, because of Manasseh the son of Hezekiah, king of Judah, for what he did in Jerusalem.","Inh gô pơm ăn kơ lu sư jing bơngai đĭ-đăng kơ dêh char lăm teh âu lăng krưp, yua kơ tơdrong yoch Manase, kon drŏ-nglo Hesekia pơtao đe Juđa, đei pơm yoch boih tơ lăm pơlei Jêrusalem."
"“For who will have pity on you, O Jerusalem? Or who will bemoan you? Or who will turn aside to ask how you are doing?","Bu gô mơnat kơ ih, ơ pơlei Jêrusalem? Bu gô hmoi kơ ih? Bu chă wơ̆t weh ngôi jet ih?”"
"You have forsaken Me,” says the LORD, “You have gone backward. Therefore I will stretch out My hand against you and destroy you; I am weary of relenting!","Kră Yang khan: “Ih sơngah achăng lê̆ Inh boih. Ih kư̆m oei kơdŭn tơ rŏng, Na Inh gô yơ̆r ti pơrăm ih; Inh ưh pă đei mơnat boih kơ ih."
"And I will winnow them with a winnowing fan in the gates of the land; I will bereave them of children; I will destroy My people, Since they do not return from their ways.","Inh gô um pơliĕng lu sư hăm kial 'bơ̆t lu 'măng jang pơlei lăm teh âu, Inh gô săi lê̆ lu sư tơ jơ̆p kơ pơlei, Inh gô pơrăm lê̆ kon pơlei pơla Inh, yua kơ lu sư ưh kơ weh đơ̆ng trong yoch, na wih tơ Inh."
